{
  "categories": [
    "Tutorial",
    "Course",
    "Discussion",
    "Best Practices",
    "Talk"
  ],
  "courses": [
    {
      "blurb": "The Feb 2025 post that named the practice: give in to the LLM, forget the code.",
      "category": "Discussion",
      "first_indexed_at": "2026-05-12",
      "key": "vibe:course:karpathy-vibe-coding-tweet",
      "published_at": "2025-02-02",
      "source": "X · Andrej Karpathy",
      "title": "Vibe coding (the original tweet)",
      "tools": [],
      "url": "https://x.com/karpathy/status/1886192184808149383"
    },
    {
      "blurb": "Plan-implement-verify loop: write a constitution and specs your coding agent can ship from.",
      "category": "Course",
      "first_indexed_at": "2026-05-12",
      "key": "vibe:course:dlai-spec-driven-development",
      "published_at": "2026-04-15",
      "source": "DeepLearning.AI (with JetBrains)",
      "title": "Spec-Driven Development with Coding Agents",
      "tools": [],
      "url": "https://www.deeplearning.ai/courses/spec-driven-development-with-coding-agents"
    },
    {
      "blurb": "Walkthrough of Spec Kit: turn markdown specs into agent-built features across Copilot, Claude, Gemini.",
      "category": "Tutorial",
      "first_indexed_at": "2026-05-12",
      "key": "vibe:course:gh-spec-kit",
      "published_at": "2025-09-02",
      "source": "GitHub blog",
      "title": "Spec-driven development with AI: Get started with the open-source toolkit",
      "tools": [],
      "url": "https://github.blog/ai-and-ml/generative-ai/spec-driven-development-with-ai-get-started-with-a-new-open-source-toolkit/"
    },
    {
      "blurb": "Beginner specialization on shipping real apps with Copilot, Cursor, Claude Code, and ChatGPT.",
      "category": "Course",
      "first_indexed_at": "2026-05-12",
      "key": "vibe:course:coursera-vibe-coding-essentials",
      "published_at": null,
      "source": "Coursera (Scrimba)",
      "title": "Vibe Coding Essentials: Build Apps with AI",
      "tools": [],
      "url": "https://www.coursera.org/specializations/vibe-coding"
    },
    {
      "blurb": "Multi-course path on orchestrating coding agents to build, ship, and maintain real applications.",
      "category": "Course",
      "first_indexed_at": "2026-05-12",
      "key": "vibe:course:coursera-vanderbilt-genai-se",
      "published_at": null,
      "source": "Coursera (Vanderbilt)",
      "title": "Generative AI Software Engineering Specialization",
      "tools": [],
      "url": "https://www.coursera.org/specializations/generative-ai-software-engineering"
    },
    {
      "blurb": "Sabrina Goldfarb teaches prompting strategies that transfer across Cursor, Copilot, and Claude.",
      "category": "Course",
      "first_indexed_at": "2026-05-12",
      "key": "vibe:course:fem-practical-prompt-engineering",
      "published_at": null,
      "source": "Frontend Masters",
      "title": "Practical Prompt Engineering",
      "tools": [],
      "url": "https://frontendmasters.com/courses/prompt-engineering/"
    },
    {
      "blurb": "Multi-tool specialization on prompt engineering, AI-assisted editing, full-stack agents, and shipping production code.",
      "category": "Course",
      "first_indexed_at": "2026-05-12",
      "key": "vibe:course:coursera-vibe-coding-for-developers",
      "published_at": null,
      "source": "Coursera (Edureka)",
      "title": "Vibe Coding for Developers",
      "tools": [],
      "url": "https://www.coursera.org/specializations/vibe-coding-for-developers"
    },
    {
      "blurb": "Ray Villalobos on driver/navigator pair programming with agents — agentic modes, system prompts, responsible practice.",
      "category": "Course",
      "first_indexed_at": "2026-05-12",
      "key": "vibe:course:linkedin-structured-vibe-coding",
      "published_at": null,
      "source": "LinkedIn Learning",
      "title": "Structured Vibe Coding with AI Coding Agents",
      "tools": [],
      "url": "https://www.linkedin.com/learning/structured-vibe-coding-with-ai-coding-agents"
    },
    {
      "blurb": "AI-assisted dev with Codex CLI, spec-driven development, TDD, and context engineering — the practice past basic vibe coding.",
      "category": "Course",
      "first_indexed_at": "2026-05-12",
      "key": "vibe:course:codecademy-ai-dev-tools",
      "published_at": null,
      "source": "Codecademy",
      "title": "AI Development Tools",
      "tools": [],
      "url": "https://www.codecademy.com/learn/ai-development-tools"
    },
    {
      "blurb": "Cross-tool workflow course: inline edits, markdown plans, background agents, MCP servers.",
      "category": "Course",
      "first_indexed_at": "2026-05-12",
      "key": "vibe:course:fem-pro-ai",
      "published_at": null,
      "source": "Frontend Masters",
      "title": "Cursor & Claude Code: Professional AI Setup",
      "tools": [
        "cursor",
        "claude-code"
      ],
      "url": "https://frontendmasters.com/courses/pro-ai/"
    },
    {
      "blurb": "Practitioner playbook: hand the agent a job, pick boring stacks, keep tools fast and observable.",
      "category": "Best Practices",
      "first_indexed_at": "2026-05-12",
      "key": "vibe:course:ronacher-agentic-coding",
      "published_at": "2025-06-12",
      "source": "Armin Ronacher",
      "title": "Agentic Coding Recommendations",
      "tools": [],
      "url": "https://lucumr.pocoo.org/2025/6/12/agentic-coding/"
    },
    {
      "blurb": "How to actually fire off multiple agents at once across worktrees without losing the plot.",
      "category": "Best Practices",
      "first_indexed_at": "2026-05-12",
      "key": "vibe:course:simonw-parallel-agents",
      "published_at": "2025-10-05",
      "source": "Simon Willison",
      "title": "Embracing the parallel coding agent lifestyle",
      "tools": [],
      "url": "https://simonwillison.net/2025/Oct/5/parallel-coding-agents/"
    },
    {
      "blurb": "Use coding agents as throwaway research workers to answer library and POC questions fast.",
      "category": "Best Practices",
      "first_indexed_at": "2026-05-12",
      "key": "vibe:course:simonw-async-research",
      "published_at": "2025-11-06",
      "source": "Simon Willison",
      "title": "Code research projects with async coding agents",
      "tools": [],
      "url": "https://simonwillison.net/2025/Nov/6/async-code-research/"
    },
    {
      "blurb": "The Ralph loop: a bash while-loop with fresh context per iteration that ships specs into code overnight.",
      "category": "Best Practices",
      "first_indexed_at": "2026-05-12",
      "key": "vibe:course:ghuntley-ralph",
      "published_at": "2025-09-08",
      "source": "Geoffrey Huntley",
      "title": "Ralph Wiggum as a software engineer",
      "tools": [],
      "url": "https://ghuntley.com/ralph/"
    },
    {
      "blurb": "Yegge's map of the six waves from autocomplete to agent fleets and how to ride them as a working dev.",
      "category": "Discussion",
      "first_indexed_at": "2026-05-12",
      "key": "vibe:course:yegge-revenge-junior-dev",
      "published_at": "2025-03-22",
      "source": "Steve Yegge · Sourcegraph",
      "title": "Revenge of the junior developer",
      "tools": [],
      "url": "https://sourcegraph.com/blog/revenge-of-the-junior-developer"
    },
    {
      "blurb": "Lovable's first pro vibe coder on PRD-driven workflows, parallel prototypes, and the 4×4 debugging method.",
      "category": "Discussion",
      "first_indexed_at": "2026-05-12",
      "key": "vibe:course:lennys-professional-vibe-coder",
      "published_at": "2026-02-08",
      "source": "Lenny's Newsletter",
      "title": "The rise of the professional vibe coder",
      "tools": [],
      "url": "https://www.lennysnewsletter.com/p/getting-paid-to-vibe-code"
    },
    {
      "blurb": "Hour-long livestream wiring three coding agents into one shipping workflow.",
      "category": "Talk",
      "first_indexed_at": "2026-05-12",
      "key": "vibe:course:theo-multi-agent-vibe-coding",
      "published_at": null,
      "source": "YouTube · Theo (t3.gg)",
      "title": "How to Use Claude Code, Codex, and Cursor for Multi-Agent Vibe Coding",
      "tools": [
        "claude-code",
        "codex",
        "cursor"
      ],
      "url": "https://www.youtube.com/watch?v=8OX_ZjQTu34"
    },
    {
      "blurb": "Long-form practitioner walkthroughs that build real apps end-to-end by voice in Cursor.",
      "category": "Tutorial",
      "first_indexed_at": "2026-05-12",
      "key": "vibe:course:riley-brown-cursor-playlist",
      "published_at": null,
      "source": "YouTube · Riley Brown",
      "title": "Vibe Coding Tutorial: Cursor + 4 Projects",
      "tools": [
        "cursor"
      ],
      "url": "https://www.youtube.com/playlist?list=PLrBQjB7hqzJlsP-oKSbJ0I0otzevS17xA"
    },
    {
      "blurb": "Long-running playlist on planning, building, and agent orchestration patterns for shipping with coding agents.",
      "category": "Tutorial",
      "first_indexed_at": "2026-05-12",
      "key": "vibe:course:indydevdan-claude-code-mastery",
      "published_at": null,
      "source": "YouTube · IndyDevDan",
      "title": "Claude Code Deep Mastery",
      "tools": [
        "claude-code"
      ],
      "url": "https://www.youtube.com/playlist?list=PLS_o2ayVCKvBR3jawG9JFIzJ1vXffi8fS"
    },
    {
      "blurb": "Simon Willison on tests, scaffolding, and review habits that make coding agents actually ship.",
      "category": "Talk",
      "first_indexed_at": "2026-05-12",
      "key": "vibe:course:pragmatic-eng-coding-agents",
      "published_at": null,
      "source": "YouTube · Pragmatic Engineer",
      "title": "Engineering practices that make coding agents work",
      "tools": [],
      "url": "https://www.youtube.com/watch?v=owmJyKVu5f8"
    },
    {
      "blurb": "Official intro covering install paths, supported IDEs, and where Claude Code fits in your workflow.",